skills;talent;trappings;career_entries;career_exits
Hazard lub Plotkowanie;Broń specjalna(palna lub dwuręczna);Broń dwuręczna(halabarda) lub Rusznica z amunicją na 10 strzałów;Biczownik;Najemnik
Opieka nad zwierzętami lub Leczenie;Morderczy atak lub Błyskawiczne przeładowanie;Skórznia;Łowca;Przepatrywacz
Powożenie lub Jeździectwo;Ogłuszanie lub Strzał precyzyjny;Mundur;Mytnik;Sierżant
Unik;Rozbrajanie lub Szybkie wyciągnięcie;Tarcza;Posłaniec;Strażnik
Wiedza(Imperium) lub Spostrzegawczość;Strzał mierzony lub Silny cios;;Strażnik;Weteran
Zastraszanie;;;;Włóczykij
